title,company,location,link
Backend Engineer (Python/APIs),Belvo Technologies,No office location,https://stackoverflow.com/jobs/536582
Python Software Engineer (Quant Trading Firm),"Old Mission Capital, LLC","Chicago, IL",https://stackoverflow.com/jobs/528807
Python Full-Stack Software Engineer,Steeprock Inc,No office location,https://stackoverflow.com/jobs/530560
Senior Backend Engineer - Python,Cornershop,"São Paulo, Brazil",https://stackoverflow.com/jobs/515697
Python Developer,UKG (Ultimate Kronos Group),No office location,https://stackoverflow.com/jobs/487629
Senior Software Engineer (m/w/d) Python,Cornelsen Verlag GmbH,"Berlin, Deutschland",https://stackoverflow.com/jobs/537066
Python Software Engineer,bloomon,"Amsterdam, Netherlands",https://stackoverflow.com/jobs/515564
Python Backend Developer (m/w/d),sonnen GmbH,"Berlin, Deutschland",https://stackoverflow.com/jobs/530609
Back-End Developer (i.e. Python),Imaginary Cloud,"Lisbon, Portugal",https://stackoverflow.com/jobs/534470
Senior Software Engineer (Python),"RealGeeks, LLC","Dallas, TX",https://stackoverflow.com/jobs/289190
Python Engineer (f/m/x),AUTO1,"Berlin, Germany",https://stackoverflow.com/jobs/529846
Software Developer (Python),Picnic,"Amsterdam, Netherlands",https://stackoverflow.com/jobs/292346
Senior Developer (Python/Django),JBS Custom Software Solutions,No office location,https://stackoverflow.com/jobs/528408
Python Software Engineer,ColdQuanta Inc.,"Boulder, CO",https://stackoverflow.com/jobs/524661
Senior Python Developer,CouponCabin,"Chicago, IL",https://stackoverflow.com/jobs/266372
Backend Software Engineer: Python/ Java (m/f/d),creditshelf,"Frankfurt am Main, Deutschland",https://stackoverflow.com/jobs/219940
Python Software Developer,EODC GmbH,"Wien, Österreich",https://stackoverflow.com/jobs/496568
Senior Marketing Software Engineer (Python) - 5605,"Chewy, Inc.","Dania Beach, FL",https://stackoverflow.com/jobs/501814
Python Engineer,McD Tech Labs,"Mountain View, CA",https://stackoverflow.com/jobs/534766
"Software Developer - Angular2, AWS, Node.js, Python",Isentia,"Pasig, Philippines",https://stackoverflow.com/jobs/528444
"Senior Back-End Engineer (Python, Django, AWS, React)",Tuune,"London, UK",https://stackoverflow.com/jobs/521987
Senior Software Engineer - Python,Andela,No office location,https://stackoverflow.com/jobs/528156
Senior Python/Django Full-stack Developer,Apicbase Belgium,No office location,https://stackoverflow.com/jobs/533361
Senior Software Developer Python (m/f/d),Ströer Online Marketing,"Hamburg, Deutschland",https://stackoverflow.com/jobs/462625
Python Software Engineer,Captivation Software,"Fort Meade, MD",https://stackoverflow.com/jobs/525426
Python Software Engineer,"JPMorgan Chase Bank, N.A.","Glasgow, UK",https://stackoverflow.com/jobs/537237
Full-Stack Engineer (Python OR Javascript),Neo4j,"Malmö, Sweden",https://stackoverflow.com/jobs/362199
Athena/Python - Software Engineer - Capital Technology,"JPMorgan Chase Bank, N.A.","Glasgow, UK",https://stackoverflow.com/jobs/535824
Senior Cloud Python Developer,Railroad19,No office location,https://stackoverflow.com/jobs/531130
Backend Engineer (Python/ Django),Sector Labs,"Dubai, United Arab Emirates",https://stackoverflow.com/jobs/518496
"Senior Software Engineer - Full-stack (Python, React)",Invitae Corporation,No office location,https://stackoverflow.com/jobs/522534
Senior Software Engineer- Python,"Ridgeline, Inc.","Reno, NV",https://stackoverflow.com/jobs/530157
Python Architect/Remote Work,BairesDev LLC,No office location,https://stackoverflow.com/jobs/537087
Senior Python Developer Remote (f/m/d),Ambient Innovation: GmbH,No office location,https://stackoverflow.com/jobs/493874
Python Developer (Remote),X-Team,No office location,https://stackoverflow.com/jobs/534454
Contract Senior Developer - Python / React (FilmTech),We Got POP Ltd,"London, UK",https://stackoverflow.com/jobs/531069
Backend Python Engineer,SQUAD,"Kyiv, Ukraine",https://stackoverflow.com/jobs/518175
Full Stack Engineer - Javascript/Python,Zumper,"Providence, RI",https://stackoverflow.com/jobs/446582
Senior Backend Engineer - Python - México,Cornershop by Uber,No office location,https://stackoverflow.com/jobs/526139
Python/Django Developer - Corporate Sector | CCB Finance Technology,"JPMorgan Chase Bank, N.A.","Plano, TX",https://stackoverflow.com/jobs/537310
Python Developer (Remote),Finsera,No office location,https://stackoverflow.com/jobs/524065
Full-Stack Software Engineer - Python,Marks & Spencer,"London, UK",https://stackoverflow.com/jobs/531490
Principal Python Engineer,ComplyAdvantage,"London, UK",https://stackoverflow.com/jobs/504216
Sr. Python Software Engineer,Global Reach Consulting LLC,"Reston, VA",https://stackoverflow.com/jobs/417839
Software Engineer - Python,Hearst Magazines,"New York, NY",https://stackoverflow.com/jobs/485603
Python/Django Developer (Remote),Soshace LLC,No office location,https://stackoverflow.com/jobs/536777
Python developer for VoIP service provider,TelSmart,"Zagreb, Croatia",https://stackoverflow.com/jobs/435753
Senior Python Engineer at QSIC,We Are Common,"Melbourne, Australia",https://stackoverflow.com/jobs/527696
CyberSecurity: Software Engineering - Python,"JPMorgan Chase Bank, N.A.","Bournemouth, UK",https://stackoverflow.com/jobs/537332
Senior Software Engineer- Python,"Ridgeline, Inc.","New York, NY",https://stackoverflow.com/jobs/530156
Software Engineer-Java-Python,"JPMorgan Chase Bank, N.A.","Plano, TX",https://stackoverflow.com/jobs/534883
Research Software Engineer for Open-Source C++ and Python Projects,Forschungszentrum Jülich GmbH,"Jülich, Deutschland",https://stackoverflow.com/jobs/535240
(Senior) Backend Python Developer (m/f/x),Alasco,"München, Germany",https://stackoverflow.com/jobs/388312
Senior Software Engineer (Remote; Python; Go; AWS),Apli Mexico S de RL de CV,No office location,https://stackoverflow.com/jobs/504966
Software Engineer - Python,"JPMorgan Chase Bank, N.A.","London, UK",https://stackoverflow.com/jobs/537023
Senior Python Developer - Spekit - High Growth Series A Startup,,No office location,https://stackoverflow.com/jobs/536887
Python Backend Developer (m/f/d) Vollzeit / Teilzeit,Favox GmbH,"Hamburg, Deutschland",https://stackoverflow.com/jobs/516375
Python Developer,,"Windermere, UK",https://stackoverflow.com/jobs/529157
"Tech Lead, Python Systems Engineering",McD Tech Labs,"Mountain View, CA",https://stackoverflow.com/jobs/523801
"Awesome Full-Stack Software Engineer - Java, Python, JavaScript (Fully Cleared)",Erias Ventures,"Annapolis Junction, MD",https://stackoverflow.com/jobs/432032
Python Developer/Remote Work,BairesDev LLC,No office location,https://stackoverflow.com/jobs/537086
Sr. Full Stack Engineer- Python,AutoTrader,"Toronto, ON, Canada",https://stackoverflow.com/jobs/529021
Senior Python Developer,Marketer Technologies AS,"Oslo, Norway",https://stackoverflow.com/jobs/518200
C++ and Python software engineers - Metrology,ASML,"Veldhoven, Netherlands",https://stackoverflow.com/jobs/523429
Sr. Python Software Engineer,"JPMorgan Chase Bank, N.A.","Houston, TX",https://stackoverflow.com/jobs/535851
Software Engineer - Python Javascript,"JPMorgan Chase Bank, N.A.","Houston, TX",https://stackoverflow.com/jobs/537005
Senior Software Engineer Python,"JPMorgan Chase Bank, N.A.","Dublin, Ireland",https://stackoverflow.com/jobs/532698
Python Software Engineer - International growing scale-up!,Channable,"Utrecht, Netherlands",https://stackoverflow.com/jobs/265091
Python Software Engineer,Trilliant Health,"Nashville, TN",https://stackoverflow.com/jobs/456801
Backend developer (Python/Django) with a passion for open source,,"Stockholm, Sweden",https://stackoverflow.com/jobs/518075
Python Software Engineer (Data Pipeline),Bloomreach,No office location,https://stackoverflow.com/jobs/524987
Senior Python Engineer,Bulb Energy,"London, UK",https://stackoverflow.com/jobs/396265
Full Stack Developer Python (m/w/d),Getränke Hoffmann GmbH,"Blankenfelde-Mahlow OT Groß Kienitz, Deutschland",https://stackoverflow.com/jobs/529969
Softwareentwickler (m/w/d) Backend Python/Go,Hetzner Cloud GmbH,"Unterföhring, Deutschland",https://stackoverflow.com/jobs/272624
Python Software Engineer,,"London, UK",https://stackoverflow.com/jobs/531788
"Software Engineering - AWS, Python, & ServiceNow","JPMorgan Chase Bank, N.A.","Plano, TX",https://stackoverflow.com/jobs/536370
Softwareentwickler (m/w/d) Backend Python/Go,Hetzner Cloud GmbH,"Unterföhring, Deutschland",https://stackoverflow.com/jobs/272624
Python Software Engineer,QuantumBlack,"London, UK",https://stackoverflow.com/jobs/372731
Senior Full-Stack Django/Python Developer,"Share Edge, LLC","Manhattan Beach, CA",https://stackoverflow.com/jobs/501234
Backend developer (Python/Django) with a passion for open source,,"Göteborg, Sweden",https://stackoverflow.com/jobs/518076
"Senior Software Engineer (Java, Python)",Kipu Health,No office location,https://stackoverflow.com/jobs/537072
Senior Fullstack Engineer - Python / Django / React,StyleSeat,No office location,https://stackoverflow.com/jobs/522691
"Data Engineer (Python, ETL)",Finsera,No office location,https://stackoverflow.com/jobs/536631
Python Software Engineer,"JPMorgan Chase Bank, N.A.","Houston, TX",https://stackoverflow.com/jobs/536717
Python Software Engineer,"JPMorgan Chase Bank, N.A.","Houston, TX",https://stackoverflow.com/jobs/536714
Mid/Senior Python Developer at QSIC,We Are Common,"Melbourne, Australia",https://stackoverflow.com/jobs/527488
Senior Software Developer (Python) for a London-based online furniture retailer,Pentalog,No office location,https://stackoverflow.com/jobs/536628
(Senior) Software Engineer (Python) - Quick Commerce (f/m/d),Delivery Hero SE,"Berlin, Germany",https://stackoverflow.com/jobs/527921
Backend Software Engineer - Python,Hubs,"Amsterdam, Netherlands",https://stackoverflow.com/jobs/533151
Software Engineering Manager (Python / GCP) (Global Service Tech) (f/m/d),Delivery Hero SE,"Berlin, Germany",https://stackoverflow.com/jobs/533082
Lead Software Engineer - Python - ASOS AI,ASOS,"London, UK",https://stackoverflow.com/jobs/455785
Python Software Engineer - Commercial Data and Analytics,"JPMorgan Chase Bank, N.A.","London, UK",https://stackoverflow.com/jobs/537361
"Senior Data Engineer (Python, Kafka, Airflow)",AMBOSS,"Berlin, Germany",https://stackoverflow.com/jobs/415218
"Software Engineer, Integration QA, Python",Canonical,No office location,https://stackoverflow.com/jobs/451978
"Remote Senior Software Engineer, Python / Flask",Verys,"Santa Ana, CA",https://stackoverflow.com/jobs/536603
Senior Python/Django Full-stack Developer,Apicbase Belgium,No office location,https://stackoverflow.com/jobs/515716
"SENIOR FULL-STACK DEV WITH RUBY / PYTHON / REACT NATIVE -- 100% REMOTE, FLEXIBLE",Analytics Fire,No office location,https://stackoverflow.com/jobs/517987
Java/Python Software Engineer,"JPMorgan Chase Bank, N.A.","Columbus, OH",https://stackoverflow.com/jobs/536007
Python Software Engineer,"JPMorgan Chase Bank, N.A.","Houston, TX",https://stackoverflow.com/jobs/537264
Senior Python Backend Developer,Alfi Inc.,"Belfast, UK",https://stackoverflow.com/jobs/520640
Infrastructure Developer - Python,"JPMorgan Chase Bank, N.A.","Houston, TX",https://stackoverflow.com/jobs/532992
Fullstack Python Developer,Cegeka Group,"Hasselt, Belgium",https://stackoverflow.com/jobs/529616
Python/Django Developer (f/m/d),TeleClinic GmbH,"München, Deutschland",https://stackoverflow.com/jobs/514324
Senior Python Developer,Ultra Tendency,"Berlin, Germany",https://stackoverflow.com/jobs/528614
Python Developer,Wise,"Tallinn, Estonia",https://stackoverflow.com/jobs/525702
Software Engineer (Java/Python),ComplyAdvantage,"London, UK",https://stackoverflow.com/jobs/528544
"Data Engineer (Python, SQL)",,"Chicago, IL",https://stackoverflow.com/jobs/526406
"Software Developer for Cloud Infrastructure, Python, C, C++",Forschungszentrum Jülich GmbH,"Jülich, Deutschland",https://stackoverflow.com/jobs/535238
"Software Engineer- Rails, Python (w/high growth company)",Nikola Corporation,"Phoenix, AZ",https://stackoverflow.com/jobs/528681
Senior Software Engineer - Python,DIGARC,No office location,https://stackoverflow.com/jobs/497630
Full-stack Engineer (Python/JavaScript/React),Susten Capital Management Inc.,"Chuo City, Japan",https://stackoverflow.com/jobs/521729
Software Engineer - Python,"JPMorgan Chase Bank, N.A.","Glasgow, UK",https://stackoverflow.com/jobs/534599
Python Engineer,Intel Corporation,"Gdańsk, Poland",https://stackoverflow.com/jobs/529943
Senior Software Engineer - C++/Python,Optibrium,No office location,https://stackoverflow.com/jobs/519482
Python Developer/ Trading Systems Engineer,,"New York, NY",https://stackoverflow.com/jobs/522467
"Software Engineer - mid level - programming, python, angular","Ciber Global, LLC","Dearborn, MI",https://stackoverflow.com/jobs/518658
"Python Back End Developer (FastAPI, Django, Celery)","Daupler, Inc.","Kansas City, MO",https://stackoverflow.com/jobs/523350
Software Engineers - Cloud Reliability & Infrastructure (Python or Java),Canva,"Sydney, Australia",https://stackoverflow.com/jobs/373689
Software Entwickler (Python/C++),JC Development AG,"Glarus, Switzerland",https://stackoverflow.com/jobs/453526
Python Engineer,"TileDB, Inc.","Cambridge, MA",https://stackoverflow.com/jobs/419347
Senior Full-Stack Django/Python Developer (Fully remote),Uncommon Giving,No office location,https://stackoverflow.com/jobs/530285
Integrations Engineer 🧰 Python | API | Data Analysis | OAuth | 100% Remote,Nira,No office location,https://stackoverflow.com/jobs/537128
Python Software Engineer (Cloud/Data Science),"JPMorgan Chase Bank, N.A.","Houston, TX",https://stackoverflow.com/jobs/536180
Python Developer,Lumen,No office location,https://stackoverflow.com/jobs/530538
Python Software Engineer- Risk & Forecasting Solutions,"JPMorgan Chase Bank, N.A.","Houston, TX",https://stackoverflow.com/jobs/531327
Java/Python Development Lead,"JPMorgan Chase Bank, N.A.","Columbus, OH",https://stackoverflow.com/jobs/536006
Senior Python Engineer,QuantumBlack,"London, UK",https://stackoverflow.com/jobs/520623
Full Stack Python / Django / React Dev for Awesome Saas,"Lead Sherpa, Inc.","Denver, CO",https://stackoverflow.com/jobs/522688
Technical Lead (Python/C++) Engineer - Realtime Data Services,"JPMorgan Chase Bank, N.A.","Jersey City, NJ",https://stackoverflow.com/jobs/537153
"Software Engineering - Java, Python, SQL","JPMorgan Chase Bank, N.A.","Chicago, IL",https://stackoverflow.com/jobs/537262
"Software engineer with Python - Developer Relations team, Security BU",VMware Bulgaria,"Sofia, Bulgaria",https://stackoverflow.com/jobs/530403
Software Engineer (Python Data Stack) (m/f/d),QuantCo,"Karlsruhe, Germany",https://stackoverflow.com/jobs/349976
Senior Software Engineer Python,H & M Hennes & Mauritz GBC AB,"Stockholm, Sweden",https://stackoverflow.com/jobs/529343
Software Developer Python (m/w/d) mit Backend-Schwerpunkt,Univention GmbH,No office location,https://stackoverflow.com/jobs/528731
Python/Cloud Software Engineer,"JPMorgan Chase Bank, N.A.","Houston, TX",https://stackoverflow.com/jobs/535909
Senior Python Developer,Fox IT,"Delft, Netherlands",https://stackoverflow.com/jobs/536568
Senior Python Engineer,Clevertech,No office location,https://stackoverflow.com/jobs/536084
Sr. Python Developer,ProQuest,"Ann Arbor, MI",https://stackoverflow.com/jobs/527043
"Senior IoT Developer (M/W/D/) Python, C++",VISPIRON CHARGE-V GmbH,"München, Deutschland",https://stackoverflow.com/jobs/524044
Senior Python Developer,"Gorilla Logic, Inc.","Medellín, Colombia",https://stackoverflow.com/jobs/519609
"Software Engineer - Embedded Access Devices (C, Python, Linux) Sydney, Australia","Casa Systems, Inc.","Lane Cove, Australia",https://stackoverflow.com/jobs/516911
QA Automation Engineer (Python),Modus Create,No office location,https://stackoverflow.com/jobs/536299
"Senior Open Source Developer & DevOps (Python, Django, AWS, OpenStack)",OpenCraft,No office location,https://stackoverflow.com/jobs/453430
Software Engineer - Python,"JPMorgan Chase Bank, N.A.","Glasgow, UK",https://stackoverflow.com/jobs/536226
Mid Python Developer,OpsTalent,"Wrocław, Poland",https://stackoverflow.com/jobs/450822
Python Developer/ Data Engineer,,"New York, NY",https://stackoverflow.com/jobs/522466
(Senior) Python Developer (m/f/d),tribe29 GmbH,"München, Deutschland",https://stackoverflow.com/jobs/526671
"Awesome Remote Software Engineer - Malware, Python, Cloud (Unclassifed)",Erias Ventures,"Annapolis Junction, MD",https://stackoverflow.com/jobs/530218
VP - AWS Python Engineer,"JPMorgan Chase Bank, N.A.","Jersey City, NJ",https://stackoverflow.com/jobs/533566
Senior Python Developer,Tenfifty AB,"Göteborg, Sweden",https://stackoverflow.com/jobs/461145
Software Engineer - Java/Python - Equity Derivatives,"JPMorgan Chase Bank, N.A.","London, UK",https://stackoverflow.com/jobs/537194
Senior Python Developer,Tenfifty AB,"Göteborg, Sweden",https://stackoverflow.com/jobs/461145
"Senior Software Engineer, Integration QA, Python",Canonical,No office location,https://stackoverflow.com/jobs/519661
Python Software Engineer,Sav.com,"Chicago, IL",https://stackoverflow.com/jobs/515692
Senior Python Engineer,,"Boston, MA",https://stackoverflow.com/jobs/524663
"VP Equity Finance Technical Lead (Python Software Engineering, Architecture, Quant-Dev)","JPMorgan Chase Bank, N.A.","London, UK",https://stackoverflow.com/jobs/537177
Infrastructure Development - Python - Kubernetes,"JPMorgan Chase Bank, N.A.","London, UK",https://stackoverflow.com/jobs/536663
Разработчик на R / Java / C / Python,Conjoint.ly,"Khabarovsk, Russia",https://stackoverflow.com/jobs/529461
"Data Engineer (m/f) (SQL, Python, R, Java)",RIAG DIGITAL,"Wien, Austria",https://stackoverflow.com/jobs/376577
Senior Python Developer: Client Onboarding & KYC,"JPMorgan Chase Bank, N.A.","Glasgow, UK",https://stackoverflow.com/jobs/535952
Senior Devops Engineer (Python scripting),Basware,"Chandigarh, India",https://stackoverflow.com/jobs/483223
Software Engineer - Python/Java,"JPMorgan Chase Bank, N.A.","London, UK",https://stackoverflow.com/jobs/533902
Senior Python Developer - Raiden Network,brainbot,"Berlin, Germany",https://stackoverflow.com/jobs/523732
Software Development Engineer C++/Python (w/m/d),Amadeus Leisure IT GmbH',"Würselen, Germany",https://stackoverflow.com/jobs/528943
"Senior Machine Learning Engineer (Python, TensorFlow)",The Meet Group,No office location,https://stackoverflow.com/jobs/496024
Senior Software Engineer (Java/Python - Data Insights),ComplyAdvantage,"London, UK",https://stackoverflow.com/jobs/528607
Senior Backend Python Engineer,"JPMorgan Chase Bank, N.A.","Jersey City, NJ",https://stackoverflow.com/jobs/537215
"Software Engineer, Associate (Java/Python)","JPMorgan Chase Bank, N.A.","Plano, TX",https://stackoverflow.com/jobs/537314
Software Engineer - Python - Optimise Ubuntu for Public Clouds,Canonical,No office location,https://stackoverflow.com/jobs/532909
Python Backend Engineer,Skillhouse Staffing Solutions,"Tokyo, Japan",https://stackoverflow.com/jobs/465919
Python Developer / Site Reliability Engineer,"JPMorgan Chase Bank, N.A.","Tampa, FL",https://stackoverflow.com/jobs/536452
Python Developer,Etiometry,"Boston, MA",https://stackoverflow.com/jobs/504970
Python Developer suchen Kollegen (m/w/d),solute GmbH,"Karlsruhe, Deutschland",https://stackoverflow.com/jobs/284443
Senior Python/Django Backend Engineer (f/m/d) - Permanent & full time,Mika,"Berlin, Deutschland",https://stackoverflow.com/jobs/529232
Senior Python Developer,CitNOW Video,"Stirling, UK",https://stackoverflow.com/jobs/516361
Enthusiastic developers for small informal software company,Black Cow Technology,"Oxford, UK",https://stackoverflow.com/jobs/503556
Python Dev Virtual Lecturer (m/f/d) Remote,DCI - Digital Career Institute gGmbH,No office location,https://stackoverflow.com/jobs/336355
(Senior) Python Data Engineer - Marketing Tech (f/m/d),Delivery Hero SE,"Berlin, Germany",https://stackoverflow.com/jobs/452393
"Senior .Net Developer for ML, Computer Vision and Python Algorithm development",MapLarge,No office location,https://stackoverflow.com/jobs/165235
Python/Perl Developer,BookTrolls,"Houston, TX",https://stackoverflow.com/jobs/521797
Python Developer,Sytac IT Consulting,"Haarlem, Netherlands",https://stackoverflow.com/jobs/534018
Senior Python Engineer - Precious Metals Technology Team Lead - Vice President,"JPMorgan Chase Bank, N.A.","London, UK",https://stackoverflow.com/jobs/536724
Associate Python Software Engineer (Athena - MFRM),"JPMorgan Chase Bank, N.A.","London, UK",https://stackoverflow.com/jobs/534064
Business/Data Analyst (Python/Jupyter/Pandas/Numpy),Hummingbot,No office location,https://stackoverflow.com/jobs/534273
Senior Python Engineer - Fixed Income Financing Technology / Repo,"JPMorgan Chase Bank, N.A.","London, UK",https://stackoverflow.com/jobs/536646
Senior Python Developer (m//f/d) with Kubernetes-Focus for Monitoring-Company,tribe29 GmbH,"München, Deutschland",https://stackoverflow.com/jobs/508981
Python System Developer (f/m/d),IONOS SE,"Berlin, Deutschland",https://stackoverflow.com/jobs/471520
"Platform Engineer (Python, Kubernetes, Docker, Azure, AWS, GCP)",buildit,"Edinburgh, UK",https://stackoverflow.com/jobs/513726
"DevOps Engineer (Python, AWS, Lamdba, Postgres, Serverless, ETL)",Finsera,No office location,https://stackoverflow.com/jobs/522969
Site Reliability Engineer - Python - Cloud - Payments,"JPMorgan Chase Bank, N.A.","Dublin, Ireland",https://stackoverflow.com/jobs/532615
Advanced Python Engineer,Research Affiliates,"Newport Beach, CA",https://stackoverflow.com/jobs/159863
"Platform Engineer (DevOps, AWS, Azure, Java, Python)",buildit,"Warsaw, Poland",https://stackoverflow.com/jobs/243854
"Sr. Web Developer- Python, Rails",Nikola Corporation,"Phoenix, AZ",https://stackoverflow.com/jobs/536346
Développeur-euse Fullstack (Python/Flask),Fintel SAS,"Marseille, France",https://stackoverflow.com/jobs/465113
"Software Eng TELECOM (C, Jenkins, Robot, Python, RAN subsys, protocols_mgt sys)","Casa Systems, Inc.","Valencia, Spain",https://stackoverflow.com/jobs/512236
Credit eTrading Application Developer (Associate) - Java/Python,"JPMorgan Chase Bank, N.A.","London, UK",https://stackoverflow.com/jobs/535902
"Tech Lead AI FinTech (60% hands-on dev in Node, Python, APIs, AWS)",Itemize,No office location,https://stackoverflow.com/jobs/527018
Enthusiastic developers for small informal software company,Black Cow Technology,"Oxford, UK",https://stackoverflow.com/jobs/119562
Node.js Developer (Remote),Soshace LLC,No office location,https://stackoverflow.com/jobs/536778
Postgres Database Administrator (DBA) - great scaling opportunities!,Channable,"Utrecht, Netherlands",https://stackoverflow.com/jobs/527117
DevOps Engineer with interesting scale up challenges,Channable,"Utrecht, Netherlands",https://stackoverflow.com/jobs/500253
"Backend Developer PHP (m/w/d) in Leipzig, Halle (Saale) oder Dresden",Relaxdays GmbH,"Leipzig, Deutschland",https://stackoverflow.com/jobs/433896
Node.js Engineer (m/f/d),Fashion Cloud,"Amsterdam, Netherlands",https://stackoverflow.com/jobs/460037
Senior Go (Golang) Developer (m/f/d),Thinksurance,"Frankfurt am Main, Deutschland",https://stackoverflow.com/jobs/512015
"Backend Developer C# (w/m/d) in Leipzig, Halle (Saale) oder Dresden",Relaxdays GmbH,"Leipzig, Deutschland",https://stackoverflow.com/jobs/433895
Product Owner - Plateforme Alpha (H/F),ENGIE Digital,"Paris, France",https://stackoverflow.com/jobs/535038
Node.js Engineer (m/f/d),Fashion Cloud,"Hamburg, Germany",https://stackoverflow.com/jobs/521823
Low Level C/C++ Software Engineer,Quantiq Partners,"Los Angeles, CA",https://stackoverflow.com/jobs/415340
React.js Developer (Remote),Soshace LLC,No office location,https://stackoverflow.com/jobs/536776
Senior Devops Engineer,Yescapa,"Bordeaux, France",https://stackoverflow.com/jobs/533140
"Frontend Developer (m/w/d) in Leipzig, Halle (Saale) oder Dresden",Relaxdays GmbH,"Leipzig, Deutschland",https://stackoverflow.com/jobs/433898
Lead Node.js Developer (m/f/d),Thinksurance,"Frankfurt am Main, Deutschland",https://stackoverflow.com/jobs/487469
QA Analyst (H/F),ENGIE Digital,"Paris, France",https://stackoverflow.com/jobs/528279
Project Manager (m/f/d) for complex medical Software for ENT applications,Stryker,"Berlin, Deutschland",https://stackoverflow.com/jobs/487294
"Senior Full Stack Developer (typescript, react, aws)",JBS Custom Software Solutions,No office location,https://stackoverflow.com/jobs/523892
Product Designer UX/UI (m/f/d) - Hamburg or Amsterdam,Fashion Cloud,"Hamburg, Germany",https://stackoverflow.com/jobs/524819
Sr Mobile Developer (iOS/Android),JBS Custom Software Solutions,No office location,https://stackoverflow.com/jobs/532933
Linux/Network Engineer,Quantiq Partners,"Los Angeles, CA",https://stackoverflow.com/jobs/415341
Senior Full-stack Web Developer,F-Secure,"Poznań, Poland",https://stackoverflow.com/jobs/526479
Backend Software Developer,xe.gr (Xrysi Eukairia),"Athina, Greece",https://stackoverflow.com/jobs/456749
Software Engineer (m/w/d) for complex medical software for ENT applications,Stryker,"Berlin, Deutschland",https://stackoverflow.com/jobs/496310
Full Stack Software Engineer,F-Secure,"London, UK",https://stackoverflow.com/jobs/514490
Senior Full-stack Web Developer,F-Secure,"Basingstoke, UK",https://stackoverflow.com/jobs/535566
"Senior Software Engineer (.NET/C#, AWS)",F-Secure,"Helsinki, Finland",https://stackoverflow.com/jobs/526478
Android Developer,F-Secure,"Helsinki, Finland",https://stackoverflow.com/jobs/530409
Junior Software Engineer (at least 1-2 years of industrial experience),"JPMorgan Chase Bank, N.A.","Herzliya, Israel",https://stackoverflow.com/jobs/533514
iOS Developer,F-Secure,"Helsinki, Finland",https://stackoverflow.com/jobs/530816
